{
  "schema_version": "0.1.0",
  "benchmark_run_id": "ff-benchmark-synthetic-001",
  "artifact_uri": "repo://factorforge-cds/benchmarks/results/ff-benchmark-synthetic-001/artifact_manifest.json",
  "manifest_digest": {
    "algorithm": "sha256",
    "value": "0123456789abcdef0123456789abcdef0123456789abcdef0123456789abcdef",
    "scope": "manifest_only"
  }
}
